{
  "$schema": "https://json-schema.org/draft/2020-12/schema",
  "$id": "https://tunefinder.setfolio.app/schemas/publish-pool/v1/batch.schema.json",
  "title": "publish-pool batch",
  "description": "One batch of a publisher run, as posted to POST /api/ingest/batch. The API's own validator is the runtime enforcement; this file is what the publisher checks itself against before posting, and what documents the wire. additionalProperties is deliberately not false anywhere: fields are added, never renamed (CONTRACTS §10).",
  "type": "object",
  "required": [
    "schema_version",
    "run_id",
    "batch_no",
    "taxonomy_version",
    "identity_version",
    "items"
  ],
  "properties": {
    "schema_version": {
      "const": 1
    },
    "run_id": {
      "$ref": "#/$defs/run_id"
    },
    "batch_no": {
      "type": "integer",
      "minimum": 1,
      "description": "1..N within the run."
    },
    "taxonomy_version": {
      "type": "integer",
      "minimum": 1
    },
    "identity_version": {
      "type": "integer",
      "minimum": 1
    },
    "items": {
      "type": "array",
      "minItems": 1,
      "maxItems": 200,
      "items": {
        "$ref": "#/$defs/item"
      }
    }
  },
  "$defs": {
    "run_id": {
      "type": "string",
      "description": "<started_at UTC to the second>-<suffix>, minted by the publisher (CONTRACTS §2).",
      "pattern": "^\\d{4}-\\d{2}-\\d{2}T\\d{2}:\\d{2}:\\d{2}Z-[a-z0-9]{1,16}$"
    },
    "family": {
      "type": "string",
      "description": "A family id of taxonomy.yaml.",
      "enum": [
        "house",
        "techno",
        "electro",
        "drum-and-bass",
        "breaks-uk-bass",
        "uk-garage",
        "electronica-downtempo",
        "hip-hop-rnb-soul",
        "reggae-dancehall"
      ]
    },
    "fine_genre": {
      "type": "string",
      "description": "A fine genre id of taxonomy.yaml.",
      "enum": [
        "house",
        "deep-house",
        "tech-house",
        "minimal-deep-tech",
        "melodic-house-techno",
        "progressive-house",
        "funky-jackin-house",
        "soulful-house",
        "afro-house",
        "organic-house",
        "bass-house",
        "indie-dance",
        "nu-disco-disco",
        "techno-peak-time",
        "techno-raw-deep",
        "hard-techno",
        "electro",
        "drum-and-bass",
        "liquid",
        "neurofunk-jump-up",
        "jungle",
        "breaks-breakbeat",
        "uk-bass",
        "140-deep-dubstep-grime",
        "dubstep",
        "bass-club",
        "uk-garage-bassline",
        "2-step-speed-garage",
        "future-garage",
        "electronica",
        "downtempo",
        "ambient",
        "trip-hop-chill-out",
        "idm-leftfield",
        "hip-hop",
        "rnb",
        "funk-soul",
        "trap-future-bass",
        "reggae",
        "dancehall",
        "dub"
      ]
    },
    "source_name": {
      "type": "string",
      "description": "A source TuneFinder fetches.",
      "enum": [
        "beatport",
        "bandcamp",
        "traxsource",
        "boomkat",
        "bleep",
        "resident_advisor",
        "mixupload",
        "volumo",
        "soundcloud"
      ]
    },
    "source_ref": {
      "type": "object",
      "required": [
        "source",
        "id",
        "url"
      ],
      "properties": {
        "source": {
          "$ref": "#/$defs/source_name"
        },
        "id": {
          "type": "string",
          "minLength": 1
        },
        "url": {
          "type": "string",
          "format": "uri"
        }
      }
    },
    "observation": {
      "type": "object",
      "description": "One day's sighting on one source. The source must be one the item carries.",
      "required": [
        "date",
        "source",
        "seen_at"
      ],
      "properties": {
        "date": {
          "type": "string",
          "format": "date"
        },
        "source": {
          "$ref": "#/$defs/source_name"
        },
        "chart_position": {
          "type": [
            "integer",
            "null"
          ],
          "minimum": 1
        },
        "seen_at": {
          "type": "string",
          "format": "date-time"
        }
      }
    },
    "preview": {
      "type": "object",
      "required": [
        "kind",
        "ref",
        "eligible",
        "checked_at"
      ],
      "properties": {
        "kind": {
          "type": "string",
          "enum": [
            "beatport_sample",
            "volumo_prelisten",
            "soundcloud_widget",
            "bandcamp_embed"
          ]
        },
        "ref": {
          "type": "string",
          "minLength": 1
        },
        "eligible": {
          "type": "boolean"
        },
        "checked_at": {
          "type": "string",
          "format": "date-time"
        }
      }
    },
    "item": {
      "type": "object",
      "description": "The CONTRACTS §7 field matrix. `families` must be exactly the set of families the item's `fine_genres` belong to, `primary_source` one of its own `sources`, and `observation.source` one of them too: three rules no JSON Schema can express, which is why the API validates and this file describes.",
      "required": [
        "key_v2",
        "key_v1",
        "artist",
        "title",
        "granularity",
        "families",
        "fine_genres",
        "sources",
        "primary_source",
        "observation"
      ],
      "properties": {
        "key_v2": {
          "type": "string",
          "minLength": 1,
          "maxLength": 512,
          "description": "The identity of CONTRACTS §1."
        },
        "key_v1": {
          "type": "string",
          "minLength": 1,
          "description": "The legacy key, for matching only."
        },
        "artist": {
          "type": "string",
          "minLength": 1
        },
        "title": {
          "type": "string",
          "minLength": 1
        },
        "version": {
          "type": [
            "string",
            "null"
          ]
        },
        "granularity": {
          "type": "string",
          "enum": [
            "track",
            "release"
          ]
        },
        "families": {
          "type": "array",
          "minItems": 1,
          "maxItems": 9,
          "uniqueItems": true,
          "items": {
            "$ref": "#/$defs/family"
          }
        },
        "fine_genres": {
          "type": "array",
          "minItems": 1,
          "maxItems": 41,
          "uniqueItems": true,
          "items": {
            "$ref": "#/$defs/fine_genre"
          }
        },
        "release_name": {
          "type": [
            "string",
            "null"
          ]
        },
        "release_date": {
          "type": [
            "string",
            "null"
          ],
          "format": "date"
        },
        "label": {
          "type": [
            "string",
            "null"
          ]
        },
        "sources": {
          "type": "array",
          "minItems": 1,
          "items": {
            "$ref": "#/$defs/source_ref"
          }
        },
        "primary_source": {
          "$ref": "#/$defs/source_name"
        },
        "bpm": {
          "type": [
            "number",
            "null"
          ],
          "minimum": 40,
          "maximum": 300
        },
        "camelot": {
          "type": [
            "string",
            "null"
          ],
          "pattern": "^(1[0-2]|[1-9])[AB]$"
        },
        "key_raw": {
          "type": [
            "string",
            "null"
          ]
        },
        "download_count": {
          "type": [
            "integer",
            "null"
          ],
          "minimum": 0
        },
        "reposts_count": {
          "type": [
            "integer",
            "null"
          ],
          "minimum": 0
        },
        "free_download": {
          "type": [
            "boolean",
            "null"
          ]
        },
        "acquisition_url": {
          "type": [
            "string",
            "null"
          ],
          "format": "uri"
        },
        "isrc": {
          "type": [
            "string",
            "null"
          ]
        },
        "catalog_number": {
          "type": [
            "string",
            "null"
          ]
        },
        "artwork_url": {
          "type": [
            "string",
            "null"
          ],
          "format": "uri"
        },
        "preview": {
          "oneOf": [
            {
              "$ref": "#/$defs/preview"
            },
            {
              "type": "null"
            }
          ]
        },
        "observation": {
          "$ref": "#/$defs/observation"
        }
      }
    }
  }
}
